{
  "source": "clean-process-ended",
  "external_receipt_kind": "process_janitor",
  "mode": "dry_run",
  "cleanup_real_executed": false,
  "evidence_sha256": "9fea6a35db5c3eff497597e3df3e87288d44aee403ddd075faab7088f5c19256",
  "evidence_sha256_scope": "receipt_payload_canonical",
  "summary": "cleanup dry-run found owned_current_session candidates, but no real cleanup was executed. Human review is required before any termination attempt.",
  "counts": {
    "processes_seen": 57,
    "candidates": 3,
    "cleanup_eligible": 2,
    "cleanup_planned": 2,
    "cleanup_executed": 0
  },
  "host_profile": "codex",
  "project_key": "example-project",
  "session_epoch_id": "epoch_fixture_candidates",
  "confirm_token_returned": false,
  "command_lines_included": false,
  "raw_process_output_included": false,
  "created_at": "2026-05-04T00:05:00.000Z"
}
