{
  "source": "clean-process-ended",
  "external_receipt_kind": "process_janitor",
  "mode": "close_check_dry_run",
  "cleanup_real_executed": false,
  "evidence_sha256": "25109e777e744fa30360566a726a4a9bcfe3d2685929f4aea44f3d45c8c7b2fe",
  "evidence_sha256_scope": "receipt_payload_canonical",
  "summary": "session_close_check completed. No cleanup candidates were eligible by the default owned_current_session dry-run policy. No real cleanup was executed.",
  "counts": {
    "processes_seen": 42,
    "candidates": 0,
    "cleanup_eligible": 0,
    "cleanup_planned": 0,
    "cleanup_executed": 0
  },
  "host_profile": "codex",
  "project_key": "example-project",
  "session_epoch_id": "epoch_fixture_empty",
  "confirm_token_returned": false,
  "command_lines_included": false,
  "raw_process_output_included": false,
  "created_at": "2026-05-04T00:00:00.000Z"
}
